HotelName,HotelAddress,HotelRating,ReviewDate,ReviewRating,ReviewTitle,ReviewText
그랜드 하얏트 서울,서울 용산구 소월로 322,8.0,2021-2,10.0,굿 서비스,"최고의 와인서비스와 직원들의 친절한 서비스에 감동하였습니다.
로비도 너무 이쁘고, 청결한 객실이 좋았습니다.
단 아쉬운거는 한강직역에서 걸어오는데 언덕위에 있어 조금 힘들었던 점이었고, 그거만 빼면 완벽!!"
그랜드 하얏트 서울,서울 용산구 소월로 322,8.0,2021-2,8.0,도심 속에서 특별한 휴가,서울에 살면서 남산을 매일 바라보며 출퇴근을 하였으나 남산의 매력을 느끼지 못 했으나 그랜드하얏트는 나에게 남산의 매력과 더불어 서울의 아름다움을 다시 한번 더 느끼게 해줬다. 그리고 최근 리노베이션을 통해 매우 클래식하며 세련된 객실이 매우 만족스러웠다.
그랜드 하얏트 서울,서울 용산구 소월로 322,8.0,2021-2,6.0,프랜들리한 맛은 없지만 전망은 넘 멋짐,가족여행객보다는 젊은 연인들에게 더 적합한 장소. 수영장 물이 차가워서 갈때마다 아이가 많이 놀지 않아 아쉬움. 투숙객에게 주차비를 받는건 좀 난해함. 그러나 전망은 정말최고임.
그랜드 하얏트 서울,서울 용산구 소월로 322,8.0,2021-2,8.0,바라는 사항,"부페나 룸써비스 음식이 맛있었으면 좋겠습니다. 조식은 다양하여 좋습니다.
성수기간 이외에도 썬베드를 유료로 운영하는 건 격이 없어 보입니다.
야외수영장은 서울시내 호텔중 최고라 여름에 자주 이용하고 있습니다. 수질관리는 좀 해주시기 바랍니다."
그랜드 하얏트 서울,서울 용산구 소월로 322,8.0,2021-2,6.0,몇몇 직원들의 문제점?,"글럽올림부스데스크직원 높은 직위같은모습의 감정없는대응과 기분나빠보이는모습?
그런대접 과 표정을본다면.그런 얼굴을보고 불친절함의 느낌을 받는다면 호텔 이미지만 나빠질듯"
그랜드 하얏트 서울,서울 용산구 소월로 322,8.0,2021-2,10.0,호캉스로 적당함,"좋은 뷰와 수영장, 친절한 서비스가 좋았다
특히 사우나와 짐에서 하는 무료 필라테스 클래스 강추
클럽라운지는 사람이 너무 많아 자리찾기 힘들다
소파베드는 상당히 불편하다"
그랜드 하얏트 서울,서울 용산구 소월로 322,8.0,2021-2,10.0,stay in gran hyatt seoul,"서비스에 대한 평가입니다. 가족의 호캉스로서 수영장 시설, 직원들의 친절함 등 매우 인상적이었고 또 찾아 오겠습니다^^ 감사합니다!"
그랜드 하얏트 서울,서울 용산구 소월로 322,8.0,2021-2,6.0,수영장 및 부대시설은 좋았습니다.,"방은 알고있던거 만큼 크진않았고 방음도 잘되징낳는걸 알고있었어요.
수영장 및 외부시설은 좋았으나 수질은 별로였어요"
그랜드 하얏트 서울,서울 용산구 소월로 322,8.0,2021-2,2.0,1박에 40만원 하는 5성급 호텔에서 최악의 룸컨디션.,"침구류에서 먼지가 너무 날려서 2박을 하였는데 1박하고 나서 먼지에 민감하지 않는 저와 여자친구 모두 기침을 하였고 옆에 테이블, 탁자에 먼지가 수북히 쌓여있음. 그래서 너무 화가나서 프론트에 전화 하였더니 바로 청소 아주머니를 불러주심.(직원들은 친절함)
청소 아주머니가 바로 오셔서 아주머니께 왜 이렇게 먼지가 나는지 여쭈어보니 여기는 원래 그렇다고 하심.(1박에 40만원이나 하는 5성 호텔에서 침구류에서 먼지가 날리는게 원래 그런것이란게 이해가 되지않음.)
그러시면서 프론트에 공기청정기를 요청 하라고 하심..
객실에 창문도 없는게 그렇게 먼지가 나는 침구류를 사용하는것이 이해가 안됨.
참고로, 저와 여자친구는 환경에 예민하지 않는 둔한편에 속하지만
여자친구가 먼저 먼지가 너무 심하고 기침이 난다고 말할정도면
예민하신 분은 절.대. 비추 드립니다.
1박에 40만원인 5성급 호텔이라고는 믿기지가 않습니다.
두번다시 방문 할 일도 추천할 일도 없을것 같네요."
그랜드 하얏트 서울,서울 용산구 소월로 322,8.0,2021-2,8.0,직원 서비스는 최상이지만 객실 상태가 미흡함.,"체크인하기 전 고객의 짐을 들어주시고, 체크인 시 매우 친절하게 고객을 응대해주신 직원분들께 감사 드립니다. 하지만 객실 청결 상태가 미흡하여 별 하나 뺍니다. 세면대 위에 머리카락 3개 있었고요, 아이 동반 4인 가족인데 타올이 달랑 세면 타올 2개, 핸드 타올 2개만 있어서 체크인 후 수영장으로 바로 다녀온 후 아이들 샤워하고 나와서 상당히 당황스러웠습니다. 발매트도 없어서 아이들 미끄러질까봐 매우 걱정스러웠어요. 공기청정기를 부탁 드려서 설치해주셨는데 매우 낡아서 제대로 기능하고 있는지 의문이 들었습니다. 하지만 남산뷰가 매우 좋아서 결과적으로 투숙 만족도는 높은 편이었어요. 아이 동반 고객을 배려한 객실 준비가 이루어져야할 것 같습니다."
그랜드 하얏트 서울,서울 용산구 소월로 322,8.0,2021-2,4.0,성수기 고객은 호구임,"성수기에 절대 가지마세요 ㅎㅎ 돈은 돈대로 성수기라 올려받고 수영장사용은 투숙일중 1일로 제한 ㅎㅎ 그마저도 관리가 안되어 수영장물은 뿌옇고 탈의실은 청소가 엉망이며 도떼기 시장을 방불케함 어디가 5성인지 찾아보기 힘듦..
그나마 기분이 풀어진건 직원들의 상냥함 그리고 괜찮은 뷰였음
다음에 또 호캉스 갈거냐 한다면 하얏트 서울은 절대 안갈거임"
그랜드 하얏트 서울,서울 용산구 소월로 322,8.0,2021-2,10.0,호캉스론 최고,"위치/시설/서비스 전반적으로 만족합니다.
다만 1박 투숙객의 경우 수영장 이용 티켓을 발부해 1회로 한정하는 것은 좀 별로 입니다. 추가 옵션을 두면 좋겠습니다."
그랜드 하얏트 서울,서울 용산구 소월로 322,8.0,2021-2,10.0,언제나 실망시키지 않는 호텔,"오랜만에 하얏트 호텔이 투숙했는데, 역시나 실망시키지 않네요. 투숙기간이 짧아서 수영장을 이용 못한게 아쉽네요. 아침식사 뷔페는 최고!!"
그랜드 하얏트 서울,서울 용산구 소월로 322,8.0,2021-2,10.0,Grand Hyatt Seoul,여름이면 가족들과 호캉스를위해 찾아가는 곳입니다 넓은 수영장과 맛있는 음식은 기억에 남습니다 다음엔 스케이트타러 겨울에 오겠습니다
그랜드 하얏트 서울,서울 용산구 소월로 322,8.0,2021-2,2.0,서울 하얏트는 최악,"1.체크인 당일 비가 오전부터 내려서 전화로 얼리 체크인 부탁함. 12시 조금 넘어 방문했는데 체크인 않된다고 해서 짐만 맡겨두고 다시 나옴.
2. 저녁때 아이들과 다시 호텔로 돌아가 체크인. 체크인 할때 짐 맡길때 받은 종이 주면서 올려보내달라고 했는데 방 도착 후 한참동안 짐이 올라오지 않아서 다시 전화로 요청함
3. 객실 화장실 문턱은 도대체 왜 만들어 놓은겁니까? 아이가 화장실 들어가다가 문턱에 걸려 변기에 얼굴을 다침. 오른쪽 볼에 피가 나서 전화로 말하고 연고 요청함. 잠시 후 연고 도착. 아이 괜찮냐고 물어보지도 않고 바르고 달라고 하길래 내일 체크아웃할때 돌려드리겠다고 하니 하나밖에 없다고 필요하면 다시 전화하라고 함.
4. 라운지 공연 보겠다고 아이들이 원해서 31,000원짜리 치즈버거 시켰는데 10살 딸아이 패티가 넘 뻑뻑해서 도저히 못 먹겠다고 함. 내가 먹어봐고 넘 뻑뻑... 난 칵테일 시켰고 아이들은 햄버거 먹는데 물이 않나왔길래 물 달라니깐 물은 유료라고 사먹어야 한다고 함. 아이들 햄버거 먹는데 목이 메여서 그렇다니깐 물 종류 알려주고 주문해야 한다고 함. 결국 9000원 주고 물 주문.
후진 노보텔 라운지 가도 아이들한테 이렇게 빡빡하게 하진 않음. 기본적으로 음식 주문하면 물은 나와야 되는거 아닌가요?
게다가 마가리타 칵테일 시켰는데 정말 바텐더가 알고 만든 칵테일인지 의문..이맛도 저맛도 아닌 맛. 그냥 한국의 마가리타는 이런가보다 하고 마심.
5. 아침에 수영장 이용하려고 지하에 내려감. 첨이라 시설에 대해 문의하니 이건 첨온 고객에게 설명하는 수준이 아님. 말로 이리 가라 저리 가면 된다 정도. 이번 JW메리어트 가니 피트니스 가서 수영장이랑 헬스장 이용한다니깐 첨이시냐고 묻고 첨이라니깐 무전기로 사람 불러 시설 안내 해주고 수영장 문앞까지 데려다 주던데 넘 비교됨.

이번 한국 방문때 3곳 호텔 이용
콘래드/메리어트/하얏트 중 하얏트가 가장 최악임.
시설 노후에 직원 서비스 엉망/ 음식맛 최악!
내 가족 내 주변 사람들이 간다면 말리고 싶네요! 개인적인 주관이지만 요즘 비즈니스 호텔 (신라스테이/롯데에서 만든 비즈니스 호텔/코트야드 메리어트 )에 가도 이보다는 나은 서비스 받습니다. 하얏트는 그냥 외국에서 가는 걸로...다시는 한국서 이용하지 않을 예정입니다."
그랜드 하얏트 서울,서울 용산구 소월로 322,8.0,2021-2,10.0,8월 호캉스,클럽룸 19층 스위트룸에서 1박2일 호캉스를 즐겼습니다 수영장도 즐거웠고 클럽라운지 덕분에 편하게 휴가를 즐겼네요 19층 한강뷰는 최고였습니다!
그랜드 하얏트 서울,서울 용산구 소월로 322,8.0,2021-2,10.0,좋습니다,"예상하는 크고 좋은 호텔의 전형적인 모습, 남산뷰가 정말 좋습니다. 웅장한 로비와 필요한 부대시설이 모두 갖춰져 있습니다. 호텔 내의 와인샵은 최고."
그랜드 하얏트 서울,서울 용산구 소월로 322,8.0,2021-2,10.0,외국 로비에 있는 듯한 분위기,"남산에 있는 호텔이라 어릴때 지나가면 어딘가 넘사벽의 호텔이였죠 여기저기 다녀와서 느껴보니 분위기가 이만한 곳이 국내엔 없네요
올드한느낌의.. 마치 타이타닉호를 탄듯한 로비의 분위기가 다른 호텔을 다녀오면 가장 기억에 남게 될것이라 자부해요"
그랜드 하얏트 서울,서울 용산구 소월로 322,8.0,2021-2,8.0,"침대 크기, 뷔페 빼고는 전부 만족","가족휴가로 하얏트를 방문하게 되었다. 방문했던 가장 큰 이유였던 야외 수영장은 사진만큼 예뻤고 사진들도 만족스럽게 나왔다. 객실 상태는 매우 깨끗했다. 뷰는 건물의 사이드 쪽이여서 아쉬웠다. 중앙쪽이 뷰가, 특히 남산 뷰는, 남산이 더 꽉차게 보여서 좋을 것 같았다. 뷔페는 조식과 디너 모두 이용해봤지만 가격에 비해서 그다지 먹을게 없었다."
그랜드 하얏트 서울,서울 용산구 소월로 322,8.0,2021-2,10.0,안락하고 좋은 시설,"도심에 있는 호텔이지만 한강 뷰와 산 뷰가 있어 경치가 참 좋다.
전반적인 시설이나 직원들의 응대가 세월의 흔적이 있음에도 깔끔하고 능숙한 느낌을 준다."
그랜드 하얏트 서울,서울 용산구 소월로 322,8.0,2021-2,8.0,편하게 쉬었습니다,휴가철이라 사람이 많았지만 직원분들의 응대가 좋아 크게 불편함을 느끼지 못했습니다. 침실도 안락하고 포근했고 수영장도 좋았습니다. 조식은 좀 더 개선되었으면 합니다.
그랜드 하얏트 서울,서울 용산구 소월로 322,8.0,2021-2,8.0,좋음,"서비스 좋고 아기 물놀이하기도 좋음. 룸서비스 좋음. 방음 아쉽고, 객실에 에어컨을 꺼두었는데도 24.6도 정도로 추웠음. 암막커튼이 아니라 새벽부터 방이 너무 밝아 아기가 일찍 깸"
그랜드 하얏트 서울,서울 용산구 소월로 322,8.0,2021-2,10.0,호캉스의 최적화,"시간적여유가 부족해 외국을 나가지 못한다면 호캉스로 최적화 된 곳이 하얏트지 않을까 싶다
개인적으로 첫 호캉스로서 많은 만족을 함"
그랜드 하얏트 서울,서울 용산구 소월로 322,8.0,2021-2,10.0,좋아요,"명불허전.
비지니스호텔느낌이 조금더 우위에있었다면 여가에도 만족도가 좀더 높아졌어요
이만큼 엔터테인할것들이 갖춰진호텔도잘없어서 언제나 만족해요. 베딩도좋아요 옆방 아기울음소리는 좀 크게들리네요"
그랜드 하얏트 서울,서울 용산구 소월로 322,8.0,2021-2,6.0,10년만에 방문...,"10년만에 방문했습니다.
1박이면 성수기에 하루만 수영장 이용할수 있는 점.
썬베드가 유료인점 모르고 앉아 있다 쫓겨난점.
설명 좀 좋게 해주시지...인터넷 예약만 가능하다네요.
객실은 무심코 손으로 훑었더니 회색 먼지가....
물티슈로 제가 청소했네요.
체크인할때 주차비 설명 안해주셔서...
저녁먹으러 나가는게 주차비가 5만원.
이건 프런트에 얘기해서 정정했구요.
해운대 하얏트에서 좋은 기억이 있어서 10년만에 서울하얏트 재 방문 했는데....
극성수기에 방문해서 그랬는지...
10년전의 좋은 추억과는 거리가 머네요.
저는 그냥 그랬네요.
주변에서 물어보는데 제 대답은 soso.
같이간 분이 하는말...
10년동안 나도 늙고 호텔도 늙었다고....
다른 지인도 같은날 묵었는데...
외부에서 곤란한 상황이라 호텔로 문의 전화드렸더니 알아서 인터넷 검색해보라고 했다네요.
극성수기에 늦은시간이라 그랬다고 생각하고 체크아웃했습니다."
그랜드 하얏트 서울,서울 용산구 소월로 322,8.0,2021-2,8.0,여름휴가 가족여행 좋아요,"야외수영장 최고 + 풀사이드 바베큐 만족 + 조식 만족 + 객실 및 시설 청결 만족!

하지만 어린이 캠핑장은 좀 허술하네요... 탑클래스 호텔의 시설이라고 보기엔 어렵요;;; 이정도 시설이라면 무료로 해야 맞을 듯 합니다...

다른 시설과 서비스는 만족!
가족 여행으로는 최고의 선택지 중 하나이네요~"
그랜드 하얏트 서울,서울 용산구 소월로 322,8.0,2021-2,6.0,침구가 눅눅하고 객실 내 먼지가 매우 많았음.,처음 입장시에 안좋은 냄새가 났음. 침대가 눅눅하고 객실 내에 먼지가 매우 많았음. 어메니티를 누가 사용했던건지 튜브에 3분의1정도 비워져있었음. 제대로 체크를 안하는 듯 했음.
그랜드 하얏트 서울,서울 용산구 소월로 322,8.0,2021-2,10.0,가족과함께한 호캉스로 강추,"호캉스 3박4일 너무 행복한 가족여행이었습니다. 조식부페 타호텔에 비하여 모든면에서 경쟁력있구요~음식 맛 청결 분위기 다 좋았어요~신선하고 깔끔한 친절한 서비스 수영장도 실내와 야외 모두 만족스러웠습니다
클럽바에서의 피치 크러쉬한잔과 라이브도 강추합니다^^"
그랜드 하얏트 서울,서울 용산구 소월로 322,8.0,2021-2,8.0,일요일 가족과,"함께 다녀왔습니다.
전반적으로는 좋은 서비스를 받았습니다.
단점 1.요청시 한시간 넘게 기다림
2.트 응대시 눈크고 키큰직원 불편하게 멘트함 불친절 최악 자격없음
3.수많은 뷔페를 다녀와봤지만 가성비 최악임 그냥 분위기 조망만 좋음(창가아니면 큰 의미없음)"
그랜드 하얏트 서울,서울 용산구 소월로 322,8.0,2021-2,10.0,하얏트,로비부터 향기가 좋아서 첫 인상이 좋았습니다. 30분정도 일찍 체크인도 해주셔서 감사했고 직원들 서비스가 특히 좋았습니다. 룸서비스 음식들은 대체로 맛있었고 수영장 컨디션또한 좋았습니다.
그랜드 하얏트 서울,서울 용산구 소월로 322,8.0,2021-2,10.0,A perfect getaway in Seoul,"서울에 살지만 서울을 벗어난 느낌, 완전히 새로운 지역에 온 것같은 느낌. 나의 삶의 걱정과 근심을 잠시 잊게 해주는 공간. 훌륭한 하룻밤의 외출"
그랜드 하얏트 서울,서울 용산구 소월로 322,8.0,2021-2,8.0,직원 응대가 아쉬운 곳,"많은 기대를 가지고 방문하였으나 타 오성급 호텔 대비 직원들의 친절도가 부족하고 안내 능력도 미흡하여 실망스러움 그 외 하드웨어는 만족
객실 내 먼지가 좀 있는 편 특히 식기류"
그랜드 하얏트 서울,서울 용산구 소월로 322,8.0,2021-2,2.0,최악의 서비스 하얏트호텔 서울,호텔 서비스를 이용하다가 불만이 생겨서 총지배인과 이야기를 나누었는데 앞으로 더 이상 서비스를 이용하는지 이용하지 않는지에 관심없는 태도로 대응을 하였고 1점평가도 아깝다.
그랜드 하얏트 서울,서울 용산구 소월로 322,8.0,2021-2,8.0,가족과 묵기엔 좀. . .,"수영장이 좋아서 선택했지만.
4명이서 자기엔 모텔보단 못 했음...
결국 5성급에 50만원이 넘는 숙박비는 전망말고는
딱히 특별한게 없음"
그랜드 하얏트 서울,서울 용산구 소월로 322,8.0,2021-2,8.0,도심속 호캉스 with 이태원 경리단길,"가족이 함께한 4박의 호캉스였습니다. 이태원 경리단길 맛집도 좋고 서울시립미술관 DDP 남대문 등등도 택시로 10분 내외라 즐길거리가 많아 좋습니다. 매년 유료화되는 부분이 늘고 있습니다.(주차비, 파라솔 선베드, 쇼파베드 침구셋팅 등)"
그랜드 하얏트 서울,서울 용산구 소월로 322,8.0,2021-2,10.0,서울 호캉스 최고,가족 여름호캉스로 최고 위치가 탁월하고 전망도 훌륭함 이태원이 바로 앞에 있고 명동도 가까움 두 지역으로 가는 셔틀버스도 있는데 훌륭함
그랜드 하얏트 서울,서울 용산구 소월로 322,8.0,2021-2,8.0,성수기엔 비추,하얏트 앱으로 예약하고 갔는데 클럽 룸이 아니라서 별로 혜택도 없고... 앱 푸쉬로 객실이 준비되었다고 해서 한시쯤 갔는데 세시에 체크인가능하다고 해서 전체 손님이 다 기다렸어요 그러다보니 3시부터 한시간 대기해서 체크인 하는 불상사
그랜드 하얏트 서울,서울 용산구 소월로 322,8.0,2021-2,8.0,살짝 애매하게 부족한 서비스,"직원 친절도, 음식, 수영장, 풍경 모든게 완벽했지만 애매하게 하나씩 빠져있었음
객실 어메니티가 없어 호출하고, 나갈 때 주차정산이 되어있지 않아 10만원이 나와서 호출함"
그랜드 하얏트 서울,서울 용산구 소월로 322,8.0,2021-2,6.0,그랜드하얏트 리뷰,5성급 호텔의 하얏트 전망은 최고이다 핮만 욕실에 배수구 쪽 핑크빛 곰팡이를 보는순간 약간의 실망.. 룸은 전망 빼면 3-4성급? 욕조에 오랜만에 오랜만에 들어가서 피로를 풀고싶었으나 욕조 없음에 당황 ㅋ 침대 좋고 인테리어 는 리모델링 한듯한 깔끔한 느낌이나... 가성비 생각하면... 전망빼고는 그냥 그렇지 않나 생각함
그랜드 하얏트 서울,서울 용산구 소월로 322,8.0,2021-2,6.0,변화가 필요,"10년전 방문했을때와 모든 것이 그대로인 점은 추억을 회상하기에는 좋으나 너무 올드해서 트렌드에 맞는 룸 인테리어가 필요함
수영장 역시 선베드나 수목 관리가 제대로 되지 않아 별도의 비치 타올이 필요하며 눕기에는 상당한 용기가 필요
과거에는 커플들의 주 방문객이었으나 가족 단위의 방문객이 많아서 커플이 특별한 분위기를 위해 오기에는 적절하지 않음"
그랜드 하얏트 서울,서울 용산구 소월로 322,8.0,2021-2,8.0,침대가드,침대가드 미리 요청했는데 체크인할때 없다고해서 쫌 당황했네요.. 아이가 엄청 뒹굴면서 자는데 가드 없어서 불안해서 지켜보느라 잠을 제대로 못잤어요 ㅠ
그랜드 하얏트 서울,서울 용산구 소월로 322,8.0,2021-2,10.0,즐거운 여름휴가,"손님이 많았음에도 불구하고 친절하게대응을 해주셔서 잘 쉬다 갑니다.
프런트 직원 분들이 특히 매우 친절하셔서 기분 좋게 쉬다갑니다.
호텔도 남산야경이 잘 보이는 곳이어서 너무 좋았어요!
조식 짱"
그랜드 하얏트 서울,서울 용산구 소월로 322,8.0,2021-2,10.0,남산 하야트 힐링의 공간으로 너무 좋았습니다.,남산 그랜드 하야트 너무 좋았습니다. 사우나 시설 및 수영장 시설도 선택의 폭이 넓게 되어 있고 넓은 테라스 및 자연경관이 호텔과 너무 잘 어울러져서 좋았습니다. 저희 가족에게는 힐링이 되는 그런 공간이였습니다
그랜드 하얏트 서울,서울 용산구 소월로 322,8.0,2021-2,8.0,모든것이 완벽한,모든것이 완벽한 하얏호텔에서의 호킹스 아가랑 같이 가서 호텔이 답답한 느낌이지만 요즘 나오는 다른호탤에 비해 룸사이즈는 답답하지않고 남산전망이라 좋았음
그랜드 하얏트 서울,서울 용산구 소월로 322,8.0,2021-2,10.0,여름에 이만한곳 있을까요?,"저는 여름에 두번은 꼭 하얏트서울에 방문합니다.
워터피아 가는것보다 하얏트서울 수영장에서 아이와 시간을 보내는것이
훨씬 더 좋습니다. 이런장소와 서비스를 마련해주신 하얏트측에 감사인사드립니다."
그랜드 하얏트 서울,서울 용산구 소월로 322,8.0,2021-2,10.0,저의 가족이 가장 좋아하는 호텔입니다,"호텔은 40년이나 되엇고 호텔리어들도 노숙하신 중년분이 많으십니다 하지만 호텔은 여전히 격식있고 아름다우며 호텔에서 받는 서비스 또한 품격있습니다.

이 호텔이 가장 멋지고 세련된 시설을 갖추었다던지, 가장 훌륭한 조식을 제공하거나, 그런것은 아닙니다.

오히려 조식이나 서비스, 침구베딩은 신라호텔이, 시설은 생긴지 얼마안되는 시그니엘이나 포시즌스가 더 좋을 겁니다

저희 가족이 이 호텔을 좋아하는 이유는 연륜이 느껴지는 이국적이고 아름다운 호텔의 모습, 방은 다소 좁지만 초록색 남산이나 불빛가득한 한강의 멋진 뷰를 가지고 잇습니다(저희는 남산뷰를 더 좋아합니다)

그리고 호텔 로비에는 늘 감미로운 라이브음악이 연주되고, 저희는 방문할때마다 남산 산책길을 거니는게 참 즐겁습니다

또 실내수영장도 좋지만, 여름철 야외수영장역시 넓고 멋져서 호텔에 머무는 동안 지루한 순간이 한번도 없었네요

룸서비스로 시켜먹은 음식들은 정성가득해보엿고 간이 담담해서 저와 가족들은 매우 좋아했습니다만 특별한 맛을 기대하거나 자극적인 맛을 선호하신다면 좋아하지않을수도 잇습니다

이태원이나 한강진도 근처라서 친구들과 놀기위해 오는것도 좋을것같습니다"
그랜드 하얏트 서울,서울 용산구 소월로 322,8.0,2021-2,2.0,시설은 5성급 서비스는 3성도 아까움,"2박3일 내내 룸에서 날파리 10마리 넘게 잡았는데 계속 나왔어요. 키즈풀에서 놀고 있는데 외국인이 더럽다고 나오라고 해서 왜그런가 했더니 누가 똥을 싸놨다고.. 그걸 외국인이 직원한테 말했는데 직원은 사라지고 제가 물속에 놀고 있으니 외국인이 말해주더라구요. 그후에 여러명 직원이 돌아다니며 소독하네 물빼네 난리였는데 (진짜 똥인가 싶어 상황을 지켜봤..) 그중 단한명의 직원도 물속에 들어간 고객이 있는지 묻지않더군요. 진짜 똥인거 확인하고 (아니길 바랬건만 ㅠ) 더러우니 올라가서 씻고 바로 체크아웃 했습니다. 체크아웃 하면서 컴플레인 하니 (날파리랑 수영장똥) 그냥 시정하겠대요.
어짜피 다시는 갈생각이 없었지만, 너무 아무렇지 않게 시정하겠다하길래 따져뭍는 일행한테 그냥 가자고 했어요. 5성급인데 수영장 위생 엉망이고 고객 응대도 엉망이었어요.

더 테라스 조식은 맛있습니다.
룸 컨디션도 좋았어요. 날파리 빼고요. (날파리가 어디서 생기는건지 20마리 넘게는 본거 같아요. 죽여도 자꾸 어디서 생겨요 ㅠ)
수영장 좋습니다. 그날 똥테러만 아니었다면 좋았을거에요. 오전11시에 발견했는데 수영장청소는 안하나 봅니다..그걸 외국인 고객이 발견해서 직원한테 말을 하다뇨.."
그랜드 하얏트 서울,서울 용산구 소월로 322,8.0,2021-2,10.0,전통과 역사가 말해줍니다,서울 내에서 이정도 시설의 호텔은 손에 꼽을정도라고 생각합니다 특히나 야외수영장은 오랜역사를 못느낄만큼 관리가 잘되어있었습니다 새단장한 객실은 새련된 디자인이면서도 안락하여 아이들과 함께여도 불편함이 없었습니다 가격은 합리적이고 서비스 또한 전통을 느낄수있는 서울 최고의 호텔중하나일겁니다
그랜드 하얏트 서울,서울 용산구 소월로 322,8.0,2021-2,10.0,서울 최고의 전망과 분위기,"주요 중심가 이동이 편리하고 부대시설이 좋다. 수영장, 사우나, 헬스장 및 부대 레스토랑이 좋다. 리노베이션이 끝나서 이전보다 좋은 경험이 될 것 이다."
