HotelName,HotelAddress,HotelRating,ReviewDate,ReviewRating,ReviewTitle,ReviewText
몬드리안 서울 이태원,서울 용산구 장문로 23,10.0,2021-2,10.0,최고의 호캉스 몬드리안,"구정을 맞어 거리두기기준을 만족한채(4인가족)

그 힙하다는 몬드리안을 방문했네요

도착후 주차(지하4층까지 있고 넓네요)후에

바로 1층에서 한바퀴둘러봅니다

와이프와 애들 모두 그 웅장함과 트렌디함에 눈을 못때네요

친절한 2층 리셉션의 인도후 바로 입실....

방은 침대 두개로하였습니다 넓지는않지만 4인가족 충분히 누울수있네요^^

랍스터 바에서 점심후에 바로 수영장과 트레이닝룸 방문

수영장 물에서 노래 나옵니다^^ 깜놀

저녁에는 안톤(최현석셰프 수제맥주집)도 들르고

루프탑도 들려서 분위기 느껴봤네요

전체적인 느낌을 적어보자면

1) 친절한 직원들의 대응

2) 20-30대를 겨냥한 힙하고 트렌디한 환경

3) 편하고 놀만한 수영장 트레이닝룸(운동 기구 지립니다)

4) 분위기 끝장나는 바들

5) 커플 및 가족 전부 어우르는 멋진곳이네요

또 가고싶네요

이번에는 야외
수영장 오픈때 가보려합니다"
몬드리안 서울 이태원,서울 용산구 장문로 23,10.0,2020-10,10.0,몬드리안호텔 투숙했어요,시설 너무 깔끔하고 직원들도 항상 웃으면서 인사주시고 다른 5성급 호텔보다도 더 좋은 기억 가지고 갑니다. 서울에서 숙박한다면 무조건 다시 여기로 오고싶어요!!
몬드리안 서울 이태원,서울 용산구 장문로 23,10.0,2021-2,10.0,좋아요,"이태원의중심 센터 깔끔 이태원의중심 센터 깔끔
이태원의중심 센터 깔끔 이태원의중심 센터 깔끔
이태원의중심 센터 깔끔"
몬드리안 서울 이태원,서울 용산구 장문로 23,10.0,2021-2,10.0,몬드리안 서울 호텔 방문,"휴일에 친구와 서울에서 가까운 호텔로 예약했습니다 처음오는데 들어오자마자 호텔 전체에 나는향이 기분이 좋았습니다 에프터눈티도 예약했었는데 창가자리로 바로 안내해주셔서 편하게 즐겼습니다
호텔안 그림과 디자인들이 여행온 기분이 들게해주네요 ㅎㅎ"
몬드리안 서울 이태원,서울 용산구 장문로 23,10.0,2021-2,10.0,설연휴간 연박하면서 좋은 시간 보내고 가요~~,"인테리어가 너무 이국적이고 시설 모두 최고로 만족스러웠어요. 스태프분들도 친절하시고 특히 프론트 송세라님, 찬님께서 궁금증이나 애로사항 빠르게 잘 해결해주셔서 큰 도움 됐어요. 넘 좋은 시간이어서 룸도 일부러 업글해서 스위트로 즐겼어요~~

수영장은 오후8시부터 노키즈존으로 운영하다보니 조명이랑 분위기가 넘 좋았어요. 지하에 편의점 및 식당가도 이용하기 편리했구요. 다른 방문객분들도 좋은 시간 보내시길 바랍니다. 사진 넘 대충 찍어 ㅈㅅㅇ...ㅋㅋ"
몬드리안 서울 이태원,서울 용산구 장문로 23,10.0,2021-2,10.0,최고의 호텔 잘 쉬었다 갑니다,"트렌디한 디자인의 객실에 할리우드 베드까지 있어서 다른 호텔에서는 느껴보지 못한 색다른 경험의 투숙이었어요.
특히나 방문객의 이름을 미리 캐치하여 객실 셋팅에 미리 신경써주신 프론트의 Luna 직원의 서비스에 감동 받았어요.
직원들의 친절함 덕분에 더욱 좋은 추억을 남기고 갑니다.
요청 사항을 빠르고 친절하게 전달해주신 관련 부서 직원들의 친절함도 잊지 않겠습니다.
다른 계절에도 또 한번 찾아오고 싶은 호텔입니다. ❤️❤️"
몬드리안 서울 이태원,서울 용산구 장문로 23,10.0,2021-2,10.0,즐거운 시간이었습니다.,"친구 브라이덜샤워 겸 방문하였습니다. 리모델링한 호텔이라고 하여 기대했는데 방은 좁았지만 좁은 방을 잘 활용한 인테리어가 만족스러웠고, 세명이 지내기에도 충분하였습니다. 또, 김지혜 호텔리어님께서 브라이덜샤워라고 하니 더욱 신경써주셔서 친구들과 즐겁게 하루를 보낼 수 있었습니다. 프로페셔널한 김지혜매니저님 감사드립니다:) 할리우드 베드가 인상적이었어요. 다음에 또 방문할게요."
몬드리안 서울 이태원,서울 용산구 장문로 23,10.0,2021-2,10.0,서울시내 최고 힙한 호텔 추천합니다,"친구들과 조촐한 파티로 다녀왓는데
김지혜(제시카) 담당님 정말 짱이예요
문 열자마자 창문에 환영문구도 기분이 좋앗는데 이것저것 어메니티 요청때마다 다 친잘히 응대해주시고
침구도 너무 편합니다!!
덕분에 아주 기분좋게 꿀잠자고 왓어요
주변에 배달시켜 먹을곳도 많고 객실 내부도 은근 넓어요
침대도 엄~~~ 청 커요!
다음에 남자친구랑 또가려구요"
몬드리안 서울 이태원,서울 용산구 장문로 23,10.0,2021-2,10.0,예쁜스테이였어요:),"호텔의 첫인상은 트렌디하고 예쁜 인테리어가 인상적이었다
객실뿐 아니라 레스토랑 로비 전체적으로 트렌디한 감성과 아름다운 인테리어 덕분에 기분이 마냥 좋아졌다
1층의 웨딩데코는 싱그러운 느낌으로 힐링자체였고 로비바의 LED 화면과 형광 에스컬레이터 또한 굿 사진 스팟이었다
객실팀 줄리 과장님과 리나 대리님 그리고 끌레오 레스토랑 서버분들도 친절한 서비스와 안내로 너무 기분 좋은 숙박이었다
여자분들이 좋아할 요소가 많고 이쁜사진을 많이 담고싶다면 이곳을 강추한다
프로포즈, 커플기념일, 젊은감성을 느끼고 싶다면 몬드리안 호텔을 추천합니다"
몬드리안 서울 이태원,서울 용산구 장문로 23,10.0,2021-2,10.0,로비라운지에서 티타임,"작년에 오픈했을때 가보고 싶었는데 실재로 와보니까 너무너무 예쁜 호텔이었습니다🍵☕️😍
이태원에서 내려서 호텔까지 시간이 좀 걸리지만 내부가 정말 고급져요!"
몬드리안 서울 이태원,서울 용산구 장문로 23,10.0,2021-2,10.0,눈호강하고 너무 좋았습니다.,호텔에 갈 당시 촬영을 하고있었기 때문에 노을을 보지는 못했지만 호텔이 너무 예뻐 눈호강하고 너무 좋았습니다. 호텔바에서 여자친구와 원플원으로 각자 두잔씩 마시고 아톤브루어리가서 식사했는데 좋더군요.
몬드리안 서울 이태원,서울 용산구 장문로 23,10.0,2021-2,10.0,"감각적인 디자인, 친절한 직원","호텔 인테리어가 너무 멋있다.
사진찍기 좋아하시는 분들은 선호할만한 호텔이다.
다만 층고가 낮아서 키가 큰 분들은
다소 불편하다고 느낄지도 모르겠다.

무엇보다 직원분들이 너무 친절하다.
당연히 호텔이니깐 서비스가 좋을 수 밖에 없다고
생각하겠지만...호캉스를 즐기는 입장에서
타 호텔과 정말 많은 차이를 느꼈다.
호텔을 처음 입장할 때부터 퇴장할 때까지
마주쳤던 직원분들이 모두 정중하고 친절한
인사를 건네주셔서 고마웠다.

면허가 없다보니 가는 방법은 힘들지만
이 단점을 이겨낼만큼 멋진 곳이다."
몬드리안 서울 이태원,서울 용산구 장문로 23,10.0,2021-2,10.0,프로포즈,"프로포즈 한다고 미리말씀드리니까
정말 많이 도움을 주셧어요 체크인 아웃 시간도 조정해주시고
클레오 식당 직원분들도 너무 친절하게 응대해주시고 너무 좋았습니다 시설만큼이나 직원분들도 최고였습니다
덕분에 프로포즈 잘하고 가요 ㅎㅎ 감사합니다"
몬드리안 서울 이태원,서울 용산구 장문로 23,10.0,2021-2,10.0,기대보다 훨씬 만족스러운 곳,"Covid19로 휴가기간 방문한 몬드리안 서울.
특유의 매력넘치는 분위기와 최고의 서비스로 좋은 기억 만들었습니다. 코로나 때문인지 front desk에 직원이 많지 않았는데 전화 및 체크인으로 정신없을 것 같은데 끝까지 차분하고 친절하게 응대해 주셔서 감사합니다. Bar 및 다양한 시설을 즐기러 재방문 하겠습니다. 서비스, 객실 모두 추천합니다"
몬드리안 서울 이태원,서울 용산구 장문로 23,10.0,2021-2,10.0,최고의 서비스와 맛!! Service is outstanding!!,"친구와 함께 방문한 cleo. 여러 레스토랑 중에 어디로 갈까 고민하다 왔는데 최고의 분위기, 맛, 서비스에 감동했습니다. 코로나로 숙박을 못하는게 너무 아쉬워요. 특히 어려움이 많이 시기에 세세하게 마음써주신 Joyce님 감사합니다. 우울한 요즘 모처럼 기분좋은 시간 보내고 돌아갑니다. 재방문 의사 100% 입니다."
몬드리안 서울 이태원,서울 용산구 장문로 23,10.0,2021-2,10.0,쾌적하고 멋짐,"새 호텔인 민큼 깨끗하고 사진찍기 예쁘고 전반적으로 만족스러웠습니다.
세면대가 좁아서 물품놓고 비누 집고놓기가 어려웠지만 가격 대비 호캉스 느낌 잘 냈습니다."
몬드리안 서울 이태원,서울 용산구 장문로 23,10.0,2021-2,10.0,너무너무 만족스러운 곳 입니다.,룸 업그레이드도 해주시고 투숙객이 원하는것을 최대한 해주시려고 하셨어요. 침구도 너무 편안하고 객실도 깨끗했습니다. 리셉션에서 너무 기분좋게 응대 해주셨던 로라님 덕분에 기분좋은 하루를 보냈습니다. 감사합니다.
몬드리안 서울 이태원,서울 용산구 장문로 23,10.0,2021-2,10.0,카메라만 갖다대면 그림♡,"수영장때문에 고심하다가 몬드리안 호텔 이태원으로 결정했어요^^ 가자마자 로비에서부터 카메라 필터 필요없이 갖다대기만하면 그림이네요ㅋㅋ
너무예뻐서 사진찍고놀아도 시간이금방가요
건물안에 편의시설모두 포함되어있어서 너무 편하게 지내다가 갑니다^^
직원분들 모두 정말 친절하세요^^ No가 없는 호텔입니다ㅋ"
몬드리안 서울 이태원,서울 용산구 장문로 23,10.0,2021-2,10.0,몬드리안 첫 투숙 경험🙂,"요즘 핫하다는 몬드리안을 남자친구 생일 맞이 방문했습니다🎂🥳🎉 생일 메모 남겼더니 좋은 뷰와 창문에 예쁜 메세지 요청까지 들어주시고 진짜 최고였어요! (체크인 할 때부터 언니가 속닥속닥 제 비밀플랜을 지켜주셔서 너무 감사했어요😌) 신축 호텔이다보니 진짜 깨끗하고 트렌디한 인테리어에 예쁜 조형물도 많아서 여기저기 포토스팟 천지였어요~ 간만에 물놀이도하고🏊‍♀️🏊 위치도 이태원쪽이라 체크인, 체크아웃 전후로 데이트 하기에도 너무 좋았어요! 직원분들도 다들 너무 친절하시고 1박 2일동안 너무 좋은 기억들만 갖고갑니다. 재방문 의사 200%입니다👍"
몬드리안 서울 이태원,서울 용산구 장문로 23,10.0,2021-2,10.0,로비부터 힙하고 감각적이에요!,"로비부터 작품설치로 힙하고 감각적인 분위기에요
엘베앞 작품부터 부분마다 설치된 작품들로 눈이 즐거웠어요
기분좋게 투숙하고가요"
몬드리안 서울 이태원,서울 용산구 장문로 23,10.0,2021-2,10.0,생일기념투숙,생일 기념으로 방문했습니다. 문을 열자마자 반가운 환대와 로비에서부터 구석구석 신경쓴 디자인까지 너무나 좋은 호텔을 방문한것같아 기분이 좋습니다.
몬드리안 서울 이태원,서울 용산구 장문로 23,10.0,2021-2,10.0,깔끔하고 시설 좋은 부티크 호텔!!,위치도 도심속에 있고 호텔 로비에서부터 예쁨이..객실 상태도 깔끔하고 직원분들도 친절하고 전부 다 좋았어요!! 친구들과 좋은 시간 보내고 가요
몬드리안 서울 이태원,서울 용산구 장문로 23,10.0,2021-2,10.0,너무 힐링하고왔어용,호텔시설이 너무 깔끔하고 음식도 맛있고 수영장이 넓어서 맘편히 재미있게 놀다왔습니다!! 인테리어도 잘해놔서 사진찍을곳도 많고 가족 커플 친구들끼리 누구와가도 제대로 힐링하고 올수있는 호텔이에요👍🏻 다음에 또 방문할거에요❤️
몬드리안 서울 이태원,서울 용산구 장문로 23,10.0,2021-2,10.0,또 가고싶은 몬드리안!!,시설도 깔끔하고 기대이상으로 너무 좋았어요!!! 코로나로 인해 야외수영장은 이용 못했지만 하나도 아쉽지 않은 호캉스 였어요~~ 실내 수영장도 그냥 몬드리안 모든게 다 좋앗어요~
몬드리안 서울 이태원,서울 용산구 장문로 23,10.0,2021-2,10.0,호캉스 왔어용,이태원 몬드리안 호텔 신축이여서 너무 깔끔하고 객실 복도도 너무 고급스러워요! 객실도 정리정돈도 잘되있어요 다음번에도 또 오고싶어요 :)
몬드리안 서울 이태원,서울 용산구 장문로 23,10.0,2021-2,8.0,친구랑 호캉스.,"어디 돌아다니는 것보다 호텔에 하루 숙박하면서 제대로 호캉스 누려보자, 해서 친구랑 둘이서 맛있는 거 시켜먹고 힐링하고 왔어요 :) 로비부터 정말 마음에 들었습니다 ! 마주치는 직원분들도 정말 친절하게 대해주셨구요 ! 지하에 띵굴이랑 서점 그리고 몇몇 편집샵들도 있어서 구경하는 재미도 있었어요 :) 아쉬웠던 건 방음이 잘 되는 편이 아니었고, 침구에 먼지가 많아 재채기가 자주 나왔습니다 :( 그래도 재방문 의사 무조건 있구요 ! 상황이 나아지면 나중엔 수영장이랑 사우나도 꼭 해보고 싶어요 ㅎㅎ"
몬드리안 서울 이태원,서울 용산구 장문로 23,10.0,2021-2,10.0,처음 방문인데 너~~~무 좋았어요!,"친구랑 둘이서 킹베드룸에서 놀았어요!
입구에서부터 취향저격이었고, 직원분들 모두 친절하셨어요!

특히 옥상에 있는 라운지바에서 칵테일 두잔 마셨는데 진짜 맛있고 좋았어요..! 분위기도 너무 좋고 인테리어가 진짜 이뻐요..!

지하에 쇼핑할수 있는 공간도 있고 맛있는 밥집들도 있어요~ 편의점도 있어서 머무르는동안 너무 편하고 좋았어요 :)

룸 컨디션도 너무 좋았고 재방문 의사 100%ㅠㅠㅠ
친구들한테도 소문내고 있어요 몬드리안 너무 좋다고ㅠㅠ

수영장도 이쁜것 같던데 이번 여름에 또 놀러가려구요!!ㅎㅎ
진짜 오랜만에 너무 좋은 곳에서 즐거운 시간 보냈어요 :)"
몬드리안 서울 이태원,서울 용산구 장문로 23,10.0,2021-2,10.0,즐거운 호캉스,직원분들도 친절하시고 객실도 깨끗해서 편하게 잘 이용했습니다 그리고 건물 내에도 예쁘게 꾸며 놓아서 눈도 즐거웠습니다:)
몬드리안 서울 이태원,서울 용산구 장문로 23,10.0,2021-2,10.0,Wonderful hotel with fantastic service.,"정말 기존 5성과는 다른 멋진 호텔입니다. 이 호텔에 생일기념을 위해 방문했습니다. 체크인부터 직원들의 따뜻한 환대와 객실 업그레이드는 상당히 이 호텔 투숙을 기대하게 만들었습니다. 특히, 프론트의 임 매니저의 환대가 인상깊었습니다. 또한, 적정한 금액에 업장별로 특색있는 음식들은 우리 부부가 행복하게 해주었고 특별한 디자인의 외부 수영장은 이 호텔이 고객에게 어필할수 있는 최고의 시설이었습니다. 최상층 객실에 투숙했는데 위층 라운지에 들리는 바닥에 의자를 옮기는 소음만 조금 거슬렸고 그 외 모든것이 완벽했습니다. 다음에 또 방문하겠습니다."
몬드리안 서울 이태원,서울 용산구 장문로 23,10.0,2021-2,10.0,또 머물게 만드는 서비스,"코로나땜에 수영장/사우나를 사용하지 못한 점은 아쉬웠지만
대신 corner studio 룸에 있는 깨끗한 욕조에서 bath time 만끽했어요! 침대가 넘 편하고 룸서비스로 시킨 와규버거와
기대하지 않있던 해산물 수프가 너무 맛있었어요.다음날 Check out time 넉넉하게 연장해 주시고 서비스가 너무 좋아 하루 더 standard 룸에서 머물렀어요. 상대적으로 공간이 작았지만 방 구조와 남산타워가 보이는 멋진 야경때문인지 그리 신경쓰이지 않았어요. 호텔 룸 인테리어도 맘에 들고 깨끗한 점이 맘에 들었지만 무엇보다도 또 찾아오게 만드는 세심한 서비스가 제일 기억에 남네요. 다음에 한국 방문할때도 또 머물고 싶네요:)

아쉬운점은 privilege bar에서 칵테일 주문했는데 물잔조차 챙겨 주지 않있던 것과 방에서 얼음이 조금 필요했는데 8,000원이나 내고 사야했던게 아쉬웠어요."
몬드리안 서울 이태원,서울 용산구 장문로 23,10.0,2020-12,10.0,프리빌리지 쵝5,너무 맛있어요. 칵테일 최고 음식최고 세계최고 직원 분들 너무 친절하세요. 즐거운 시간을 선사해주셔서 너무 감사합니다. 번창하세요!
몬드리안 서울 이태원,서울 용산구 장문로 23,10.0,2020-12,10.0,몬드리안 서울 호텔 숙박,"이태원쪽에 있는 몬드리만 호텔에 숙박을 하게되었는데 룸 컨디션 좋았고 구조랑 방크기 화장실,등등 리모델링을 해서 그런지 깨끗하고 정돈도 잘되있어 기분좋게 숙박을 했습니다
다음에도 기회가 된다면 숙박을 할 계획입니다"
몬드리안 서울 이태원,서울 용산구 장문로 23,10.0,2020-12,10.0,직원분들의 서비스 최상,"직원분들의 서비스는 5성급에 걸맞은 서비스였습니다.
다만 자다가 깰 정도로 룸이 건조했습니다.
보완하면 좋을 것 같습니다."
몬드리안 서울 이태원,서울 용산구 장문로 23,10.0,2020-12,10.0,"컨디션, 서비스 최상입니다","트렌디한 인테리어, 다양한 인프라, 룸 컨디션 모두 최상입니다. 룸이 좁고, 비데나 욕조가 없는 건 조금 아쉽지만 고층 탁 트인 뷰 너무 좋았구요!! 침구도 포근하고 좋았어요.
다만 룸이 심하게 건조해서 개선되면 좋을 것 같아요!
내년 여름 수영장 오픈하면 재방문 꼭 할게요~"
몬드리안 서울 이태원,서울 용산구 장문로 23,10.0,2020-12,10.0,이태원에서 핫한 몬드리안👍🏻 오픈 초기에 한 투숙 경험입니다! 몬드리안 대추천해요🙂,"결혼기념일을 맞아 남편과 이태원에 새로 오픈했다는 호텔이 있다 여 몬드리안을 방문하게 되었습니다. 참고로 저는 18층에 위치한 스튜디오 스위트에 투숙했습니다! 우선 한 줄로 요약하자면, 몬드리안은 제가 여태껏 방문했던 호텔 중에 가장 세련되고 유니크한 최고의 호텔이었습니다👍🏻 스위트에는 식탁, 긴 쇼파 2개, 쇼파 테이블, 침대, 티비 2대, 스위트답게 잘 갖추어져 있었습니다. 그리고 인테리어 자체가 굉장히 모던했고 깔끔했습니다. 천고가 높아 좁다는 느낌은 전혀 못받았고요! 가구 자체가 너무 제 스타일이어서 우리 집이면 좋겠다고 남편한테 몇 번이나 말했는지☺️ 보통 호텔에서 로비에 힘을 줬다면 로비만 화려하고 방은 섬세하게 신경쓰지 못한 곳들이 많은데 몬드리안은 로비도, 객실도 호텔 전체적으로 모두 신경 쓴 느낌이었어요. 그리고 가장 중요하게, 투숙하는 동안 제가 마주친 직원 분들 모두 친절하셨어요. 럭셔리 호텔을 가도 불친절한 직원을 마주하면 투숙 경험이 불만족스러워지잖아요. 몬드리안 직원 분들은 눈 마주치면 항상 먼저 인사해주시고 웃는 얼굴로 맞이해주셨어요. 저는 요즘 주변에서 호텔 얘기하면 항상 몬드리안을 추천해요! 그 정도로 만족스럽고 다시 방문하고싶은 호텔이었습니다. 좋은 투숙 경험 감사해요🙂"
몬드리안 서울 이태원,서울 용산구 장문로 23,10.0,2020-12,10.0,호텔 너무 좋아요:),"룸 분위기 너무 예뻐요:)남자친구랑 너무 즐거운 시간 보내다가 가요
담에 또 재방문 하려고요
너무 친절하시구 첨에 웰컴 음료 맥주 주셨는데 선물 받는 것 같고 너무 기분이 좋았어요
룸은 커플,친구,신혼에게 딱 인것 같아요"
몬드리안 서울 이태원,서울 용산구 장문로 23,10.0,2020-12,10.0,몬드리안 첫 투숙,"직원들 너무 친절하고, 호텔 디자인도 너무 예쁩니다.
투숙하면서 룸서비스도 이용했는데 너무 맛있었습니다.
만족스러운 투숙이였습니다."
몬드리안 서울 이태원,서울 용산구 장문로 23,10.0,2020-12,10.0,너무좋았어요,인테리어도 감각적이고 리셉션이나 룸서비스도 훌륭했습니당 오늘의 게스트로 선정되서 룸업그레이드 받았어요:) 재방문하고싶습니다
몬드리안 서울 이태원,서울 용산구 장문로 23,10.0,2020-12,8.0,좋았지만..,실내 실외 수영장 너무 좋았습니다. 웰컴카드도 감동적이 었구요. 다만 제가 폐질환이 있는데 엘리베이터에 설치된 세스코는 정말 당황스러웠습니다. 밀폐된 공간에 분사 된 세스코 때문에 두통과 구토증세 호흡곤란이 있었습니다. 소독차원에서 설치했을텐데 향균필름과 잦은 청소로 대체해 주셨으면 좋겠습니다.
몬드리안 서울 이태원,서울 용산구 장문로 23,10.0,2020-12,10.0,"로비라운지, 타카",타카 스키야키 음식 이쁘게 나오고 맛도 좋고 로비 라운지 분위기도 좋고 서울에 있는 호텔중 분위기 최고 입니다 강추입니다
몬드리안 서울 이태원,서울 용산구 장문로 23,10.0,2020-12,10.0,몬드리안 호텔에서 편하게 쉬고갑니다 ^^!,생일이어서 룸 업그레이드에 기념 폴라로이드 사진 그리구 정성스러운 손편지까지 기분 좋은 시간 보내고 갑니다 ! 코로나 때문에 수영장을 못 즐겨서 너무 아쉽지만 상황이 호전되면 다시 또 방문하도록 하겠습니다 ㅎㅎ 신경써주셔서 감사드립니다.
몬드리안 서울 이태원,서울 용산구 장문로 23,10.0,2020-12,10.0,행복한곳:),"결혼1주년방문으로 몬드리안을 선택하여 방문했습니다 프론트 직원분들 부터 정확한 안내와 밝은표정이 기분이 좋았습니다 객실은 깨끗했고 화장실 샤워실에 예민한 저는 이번 투숙에 전혀 나무랄곳도 없이 정말 완벽한 결혼기념일 이였습니다준비해주신 1주년 기념 맥주도 너무 감사드리고 이용하고싶었던 피트니스클럽, 수영장이 2.5단계여서 이용을 못했지만 다음번에 무조건 또 이용하겠습니다 윗층에 있는 프리빌리지바 방콕을 온것만 같은 느낌이였어요 몬드리안 호텔 전체가 해외여행온것같은 느낌이라 매우매우매우 행복했습니다❤️ 이런 예쁜호텔 만들어주셔서 감사하고 친절하신 직원분들께 다시한번 감사의 말씀을 드립니다 건강하시고 메리크리스마스에요*^^*"
몬드리안 서울 이태원,서울 용산구 장문로 23,10.0,2020-12,10.0,200일 기념,남자친구와의 200일을 기념하기 위해 방문했는데 직원분들 넘 친절하시구 맥주에 창문에 이쁜 축하문구까지 너무 행복한 투숙이었어요!! 너무 고맙습니다~!! 자주 방문할게요~
몬드리안 서울 이태원,서울 용산구 장문로 23,10.0,2020-12,10.0,너무 좋았어요🥰,"언니 생일 기념해서 몬드리안 서울 이태원에 방문하였는데 생일이라고 말씀드렸더니 여러가지 챙겨주신 점과 너무 친절하셨던 게 정말 좋았어요! 그리고 감각적인 여러 미술품들과 디자인 등.. 힙하고 좋았습니다! 루프탑이 공사중이었어서 방문 못했지만 다음에 꼭 방문하고 싶어요☺️ 여름에 수영장도,, 꼭,,!! 다음에 또 뵐게요!"
