HotelName,HotelAddress,HotelRating,ReviewDate,ReviewRating,ReviewTitle,ReviewText
임피리얼 팰리스 부티크 호텔,서울 용산구 이태원로 221,8.0,2021-2,6.0,Ip 부티크 호텔,"6월에 이곳에 3일 밤을 출장으로. 이상한 장소. 펑키, 하지만 약간 이상한 방법, 특히 매우 어두운 복도 - 실제로 활성화하기 위해 토치의 제가 모바일 이동하려면 제 방! 즉, 가격 대비 아주 좋음. 객실도 좋았어요. 편안한 침대와 에어컨의 문제도 다른 리뷰에서 언급. 충분히 괜찮은 욕실 시설, 편안한 침대, 보통 차/커피 메이커 및 ipod 도킹 스테이션도! 와이파이까지 비싸지 을 이 곳에서는. 조식 훌륭하진 않지만 스타벅스는 부부의 오른쪽 건물로 들어간 호텔.
매우 제한된 음식과 음료 제공 입니다 필요가 없지요. 이태원에, 호텔에 잇는 넘쳐나는 활기 의 좋은 바와 레스토랑에서 십오분 전, 고민없이 점수.
또 이곳에 머물거냐구요? 달라집니다. 오 휴가 및 다음 예는 버짓과. 이태원 는 곳과 잎 의 도시 - 호텔은 좋은 느낌과 상당히 큰 힘과 기지 인근 우리 서방 집단 2ip 도 괜찮고요. 즉, 그랜드 하얏트 호텔은 오성급 대안이 멀지 않은 곳.
다음 출장 여행을 하더라도 제품 호텔 선정된 모임 (s) 에 따라 (용) 위치. 서울엔 세 cbds 및 트래픽이 어서 정말 끔찍한 에서 위치를 논하지 마세요. 이것은 무난한, 하지만, 콘래드는 리츠칼튼 도 아니다. 원하는 경우에 따라 다릅니다."
임피리얼 팰리스 부티크 호텔,서울 용산구 이태원로 221,8.0,2021-2,8.0,"훌륭한 호텔, 훌륭한 디자인, 훌륭한 위치","이곳에서 비즈니스. 직원들은 제가 만든 것이나 나는 여행지 및 모든 정보를. 방은 멋지고 유지의 디자인. 방에는 충분한 시설, 약간 아쉬웠던 점은 에어컨이 없는 늙은말 과 방 아주 후덥지근 했습니다. 많고 주변에 멋진 나이트라이프 등. 강력 추천합니다."
임피리얼 팰리스 부티크 호텔,서울 용산구 이태원로 221,8.0,2021-2,8.0,완벽한 위치의 훌륭한 호텔,"세련된 이 호텔은 열심히 노력하고, 세워 주고.
위치는 완벽한 중심부의 이태원 (팁, 걸어서 올라가는 좁은 언덕길 양 옆 큰길 과 훌륭한 레스토랑을!)

처음 이틀은 아니었기에 소음 발생기 또는 완벽한 옥상이 ㄴ가, 하지만 저희 방이 행복하게 의무.

모든 것이 정말 깨끗하고, 무료 와이파이 서비스는 친절하고 능숙했고.

또 묵고 싶습니다!"
임피리얼 팰리스 부티크 호텔,서울 용산구 이태원로 221,8.0,2021-2,8.0,"훌륭한 숙박, 좋은 호텔","이것은 아주 좋은 호텔, 위치도 좋고 (이것이 동네는 24/7), 지하철 역 근처 (3min. 워킹), 잘 꾸며진, 협조적인 직원들. 방은 작은 (이는 서울... ), 좋은 화장실 용품들. 나는 조식 카페 아미가 추천, 호텔 레스토랑 - 조금 비싸고 옵션도 너무 많은 생. 옆에 스타벅스가 있겠지만 한국 베이커리 추천 파리바게트 지하철 역 근처라 는 (이것은 이미 몇몇 미국 도시 같은 체인 - 버클리 하나 아는 한 los angeles): 좋은 커피와 신선한 빵을 하루 종일. 후회하지 않습니다."
임피리얼 팰리스 부티크 호텔,서울 용산구 이태원로 221,8.0,2021-2,6.0,작 은 객실,"호텔 은 중앙 에 위치, 하지만 방 은 작 고 어둡 은 방 을 남기 고는 밤 잠. 제 방 에서 시간 을 보내 는 작업 이 매우 고무 되 지 않 습니다. 조식 도 괜찮 았고, 무엇 보다. 나 는 다시 여기서 묵 었지만 출장 으로 더 분위기 가 필요 하 ㅂ니다."
임피리얼 팰리스 부티크 호텔,서울 용산구 이태원로 221,8.0,2021-2,8.0,ok; 대체로 실망 호텔 서울,"Ip 부티 크 호텔 은 서울 의 좋 은 딜. 찾기 어려우므로 125,000 KRW 서울 에 좋 은 호텔. 대부분 의 호텔 에서 이태원 과 명동 이 우왕 않으면 셸을 배 돈 을 롯데 호텔. Ibis 명동 이 끔찍하 였습니다. 나 보다 서울 게스트 하우스, 러브 모텔 의 반값. 즉, 만약 당신 이 묵 는 호텔 보다 괜찮 은 게스트 하우스 보다는 한옥 / 러브 모텔 /, ip boutique 적합합니다.

좋 은 위치 에 있 고 공항 버스 이태원 호텔 에서 바로 길 을 건너. 장식 은 다소 파격 적 이 ㄴ. 그다지 내 스타일 은 아니 었지만 괜찮 았어요. 호텔 청소 는 없 습니다. 복도 가 어둡 고 정말 뭣 일부인 장식 / 분위기 에 호텔 은; 저 는 단순히 생각 에 변명 은 더욱 늘어나고 전기, 숨기려면 얼룩, 먼지, etc. 내방. 보 ㄴ 캔디 랩핑재는 남긴 이전 점유자 이 좋 은 카펫. 경우 카펫 은 샴푸.

아침 식사 는 불포함 이 며 셸을 제 생각 에 머물 ㄴ 호텔 의 조식 부페 27,000 KRW. 저 는 시도 하 ㄴ 출장 이 었습니다. 하지만, 만약 당신 이 지불 하 는 것. 나 는 그냥 나가 는 돈 을 하 ㄴ 서양식 아침 식사 에 이태원. 있 는 것 보다 더 저렴 하 였고 호텔 은 충전 아침.

묵 은 더 싸 ㄴ 중국 일본 에 아주 솔직히. 제 가 머무르 ㄴ 서울 에서 비싸 ㄴ 비즈니스 호텔 도 감동 에 비하 여 일본 의 중국. 서울 에서 (전용) ip 부티 크 호텔 은 괜찮 은 곳 이 었다. 하 ㄴ 단계 의 호텔 은 서울 경기? 절대 적. 먼저 시작 하 여 모든 숙박 무료 조식 제공."
임피리얼 팰리스 부티크 호텔,서울 용산구 이태원로 221,8.0,2021-2,8.0,좋 은 곳 은 비즈니스 회의,"좋 은 장소 는 비즈니스 회의, 미팅 룸 도 매우 좋 은 가격 이 었습니다.

여러 좋 은 레스토랑 에 걷 어서 가 ㄹ 수 있 는, 브라질 에서, 한국, 아시안 스타일 및 기타 모든.

그리고 완벽 하 ㄴ 엔터테인먼트 ㄴ 클럽 과 바 에서 시간 까지 즐기 ㄹ 수 있 다."
임피리얼 팰리스 부티크 호텔,서울 용산구 이태원로 221,8.0,2021-2,6.0,평균 경험,나는 이 호텔을 위치에 이태원 으로의 첫 여행 서울. 로비는 매우 좋지만 나머지 호텔은 아주 허름합니다. 조식이 포함되지 않는 저렴한 숙박 요금이 비싼 편. 위치도 좋고 싶다면 상대방이 매일 저녁 다른 것 같아요. 이 어두운 복도와 객실 가구가 품질. 욕실은 좋았지만 거울과 샤워는 아시아를 위한 설계. 호텔을 바꿨는데 이틀 후.
아이티더블유 호텔,서울 용산구 우사단로14길 11,7.0,2021-2,6.0,가성비,"가성비가 좋아요
방이 좁긴한데 가성비가 좋아서 큰 문제되지는 않아요 그냥 한번쯤 숙박해볼만 합니다
가성비로 예약해봤어요"
아이티더블유 호텔,서울 용산구 우사단로14길 11,7.0,2021-2,2.0,최악,"호텔이라는 명칭이 어떻게 달 수 있는디 모를 모텔 이름의 호텔이다.
친절한척 하지만 절대 친절하지 않고 직원은 업무도 모르고 본인이 불리한 일은 모르쇠 일관이다.
시끄러운 위치의 약점을 가지고 있다면 적어도 진심어린 친절은 필수요소다."
아이티더블유 호텔,서울 용산구 우사단로14길 11,7.0,2021-2,8.0,이태원 호텔,"비즈니스차 방문해 숙박했는데 깔끔하고 찾기 쉬웠습니다.
다만 주변 상권때문인지 오는길 길거리에 취객들과 외국인들이 너무 많아 조심하면서 왔습니다."
아이티더블유 호텔,서울 용산구 우사단로14길 11,7.0,2021-2,6.0,숙박기능에만 충실,당일예약어플로 예약하고 정말 비교적 저렴한 가격에 들어갔는데 객실 도어락 고장나서 방에서 나오는데 한 20분은 소비했어요.. 위치가 위치인만큼 시끌벅적한건 뭐 감수해야하지만.. 방이 워낙 작아서 그냥 자는거 외의 기능은 기대하지않는게 좋을 것 같아요
아이티더블유 호텔,서울 용산구 우사단로14길 11,7.0,2021-2,6.0,조금 작은 느낌의 호텔,"가격대비 방이 다소 작은 편입니다.
스탠다드 룸과 스윗트룸의 차이는 테라스의 유무 정도입니다.
테라스 있는쪽이 좋기는 합니다.

스윗트룸은
침실과 욕실이랑 입구가 분리되어 있습니다.

침대는 편안한 편이구요. 욕실도 큽니다.
조금 냄새가나서 환기를 시켰습니다.

가격이 조금 저렴하다면 괜찮을것 같은 장소입니다.
두번째 이용이고 위치는 마음에 듭니다."
아이티더블유 호텔,서울 용산구 우사단로14길 11,7.0,2021-2,8.0,이태원에 있는 reasonable price의 깔끔한 호텔,"부티크 분위기의 호텔로, 실내청소가 매우 깔끔하였습니다.
남편과 함께 이 곳에 왔던 이유는 이태원에서 시간을 많이 보내고 잠만 잘 수 있는 곳을 찾고 있었는데 특급호텔에서 묵기에는 잠만 잘건데 가격이 아깝더라구요.
그런데 눈이 높아진지라...깔끔한 호텔이 아닌곳에서는 묵고 싶지는 않았고
그러다 이 호텔을 발견하였습니다.
침구도 호텔급 푹신하고 안락했습니다. 에어컨도 빵빵하구요

다만 티비가 너무 높은 곳에 위치하고 있어서 침대에 누워서 보는데 고개가 아팠습니다. 티비 위치의 재조정이 필요해 보입니다.
또한 호텔 입구 위치가 19세출입금지 구역의 골목에 위치하고 있어서 저녁에 약간 신경쓰이는 부분은 있었습니다."
아이티더블유 호텔,서울 용산구 우사단로14길 11,7.0,2015-11,4.0,최악의 서비스의 시끄러운 호텔,"10월 경 방문하여 숙박하였습니다.
트윈을 배정하길래 더블로 달라 했더니, 더블이 없다고 합니다.
하지만 컴퓨터상의 배정표에는 더블이 남아있습니다.
예약도 없는데 말이죠.
대실을 위해서 남겨둔 것입니다.

호텔의 분위기는 매우 시끄럽습니다.
한국 유흥가의 중심 이태원의
홍등가 옆에 위치한 곳이기 때문입니다.

아이들과 함께 가신다면
절대 가지 마십시오.
교육을 위해서라도, 숙면을 위해서라도"
아이티더블유 호텔,서울 용산구 우사단로14길 11,7.0,2021-2,8.0,괜찮은 호텔,"나쁘지 않아. 나는 서울을 방문 할 막판 계획을 세웠고, 해밀턴은 완전히 예약되었으므로 이것을 시도하고 싶었다.

그것은 이유가 분명히 저렴합니다. 침대는 꽤 거칠고 벽은 꽤 가늘다. 당신은 이웃 사람들이 사업하는 것을들을 수있다. 주말에는 가족 친화적이지 않습니다.

하지만 그렇지 않으면, 꽤 좋은 위치. 좋은 편의 시설. 친절한 직원들도!"
아이티더블유 호텔,서울 용산구 우사단로14길 11,7.0,2018-10,8.0,파티를 좋아한다면,"그래서이 지역은 많은 변태 성의 사람들과 술취한 사람들로 인해 정말로 이상하고 더러워졌습니다. 하지만 당신이 동성애 지역과 가까워지기를 원하면. 호텔 자체는 깨끗하고 괜찮습니다. 위치는 Itawon와 그 레스토랑, 바 그리고 클럽 근처에서 위대했습니다. 방은 조금 작다. 그리고 얇은 벽 그러나 가격을 위해 그것은 매우 좋았다! 나는 파티 동물이지만 가족과 함께하지 않는 것이 좋습니다."
아이티더블유 호텔,서울 용산구 우사단로14길 11,7.0,2021-2,6.0,당신은 당신이 지불하는 것을 얻습니다.,"장점 :
 - 호텔은 저렴한 가격으로 객실은 두 사람이 편안하게 맞을만큼 충분히 큽니다.
 - 서울역, 김포 공항, 인천 공항에 쉽게 접근 할 수있는 지하철역에서 도보로 5 분 이내 거리
 - 이태원의 다양한 레스토랑, 바, 클럽과 가깝습니다.

단점 :
 - Itaewon의 ""더러운""부분에 있습니다 (일부 사람들에게는 이것이 프로일지도 모릅니다).
 - 호텔은 확실히 고객을 기쁘게하기 위해 노력하지 않는다. 나는 친구를위한 두 번째 방 열쇠를달라고 요청했고, 그들에게 ""한 방, 한 키""정책이 있다고 전했다. 나는 당신이 당신의 열쇠를 잃더라도 벌금이 있다면 놀라지 않을 것입니다.
 - 벽은 얇으며 외부 및 / 또는 다른 방의 소음에 대비하십시오.
 - 방에서 연기 냄새가 난다.

Itaewon의 다른 모든 적절한 옵션이 가득차 있다면 나는 다시 갈 것입니다."
아이티더블유 호텔,서울 용산구 우사단로14길 11,7.0,2021-2,8.0,좋은 깨끗한 호텔!,"이태원은 명동보다 인상적이지 못하지만, 호텔 자체는 돈을 위해 좋은 가치가 있습니다. 깨끗하고 편안합니다. 이태원이 서울에 머물고 싶은 곳이라면이 호텔을 선택하는 것이 좋습니다. 인근 할랄 음식점이 많이 있습니다. 지하철 및 버스로 서울의 다른 지역과 잘 연결됩니다. 공항 셔틀 버스 정류장 또한 인근 공항 픽업 서비스를 제공합니다."
아이티더블유 호텔,서울 용산구 우사단로14길 11,7.0,2021-2,6.0,좋은 위치에서,"이 호텔은 이태원 중심에 있는 모든 바, 클럽, 레스토랑이 근처에 있습니다. 내 방에 있다고 하지만 꽤 깨끗하고 내 예약 도시. 욕실은 온수도 잘 수압도 좋았어요. , 침구와 타월은 아주 좋았습니다. 욕조는 아주 작아서 안에 누워 수 없었습니다. 직원들은 불친절하고 꽤 갑자기. 한 가지 답을 따뜻한 또는 친절함을 전혀. 그 유명한 기본 및 깨끗하지만 사람들이 실망했다."
아이티더블유 호텔,서울 용산구 우사단로14길 11,7.0,2021-2,4.0,에는 여자와 아이들이,"이태원에 위치한 이 호텔은 - 동 소호 지역 이 어디 술집과 식당도 많습니다. 또한 이태원 역 근처에 있는, 다른 장소가 있어서 매우 편리합니다. 그러나, 일부 미니 - 클럽 호텔로 가는 길. 술에 취한 사람들과 함께 있었던 여자는 섹시한 클럽은 밤에 호텔로 가는 길. 그래서 나는 여자와 아이들이 이곳에 머물기 를 제안하지 않는다.
우리가 묵었던 방은 침대 두 개 에 4일 밤. 방은 침대가 두 번 해보지 를 걸은 두 발 의 상처. 로비에서 복도는 강한 향수 이 기 때문이다. 냉장고에 물 두 병 있다, 안 하고 있지만. 각 $2000 불어 코트. 화장실의 위생 상태는 평균 이하. 나쁜 냄새가 났고 모든 것은 흰 수건 에 있는 그레이 컬러.
튀김 닭 프론트 데스크 에서 주문할 수 있습니다. 직원들은 친절하고 도움이 되었습니다. 영어를 잘 해서 보통 화 수 있습니다.
가격이 $450 홍콩 달러 에 두 개의 침대가 있는 방. 그래서, 아니라면 좋아하시는 (제한된 방에 공간 및 여행 회사, 적절한 수 있습니다."
아이티더블유 호텔,서울 용산구 우사단로14길 11,7.0,2021-2,8.0,편리함,"묵은 때 가 여러 번까지 i. 해밀턴을(를) 예약을 했습니다. 이태원에 있는 골목에 위치해 있어, 좋은 또는 나쁜 일 수에 따라 방문하는 이유 다. 밤 문화를 찾는다면, 이 호텔 정말 좋아요! 언덕 아래에 있는 길 건너편에 있는 제가 가장 좋아하는 바. 추가한 경우 코드에 당신도 잊어. 체크인 - 체크인 / 인 - 종료 합니다. 무료로 제공 - 차를 주차할 수 있는 경우."
아이티더블유 호텔,서울 용산구 우사단로14길 11,7.0,2021-2,8.0,방문,"저는 이 호텔에 두 번 묵었으며, 전체적으로 깨끗하고 친절한 직원, 좋은 위치에 있는 이태원의 중심에 있는 지역.
방 시설이 아주 허용 을 포함한 세면 도구 (치약, 칫솔, 빗, 등). 안전 금고, 주전자, 차, 커피.
에서 할 수 있는 모든 것은 리셉션의 직원들은 열심 지원하기 위해 손님 수 있습니다."
아이티더블유 호텔,서울 용산구 우사단로14길 11,7.0,2021-2,2.0,의도하지 않은 유지,"가난한 연구 결과 다, 이 호텔은 예약을 에 가까운 가격이 같이 이 이벤트가 있는 그랜드 하얏트 다. 사진은 전체 저장을 확실히 제공하지 않습니다.

저는 여성 주의 모든 여행객들이 숙박하는.
내에 위치한 호텔은 이태원의 홍등가. 주변 모든 가게들이 있다고 했는데.

방, 아쉬움 도 없다:
1. 또한 담배 reaked
2. 얼룩 명백한 침대 시트 위에
3. 가상 타월과 옅은 회색을

그리고, 이 모텔이나 호텔로 분류되어야."
아이티더블유 호텔,서울 용산구 우사단로14길 11,7.0,2021-2,8.0,좋은 위치,"지난 주에 2일을 묵었는데 itw 호텔 이태원. 이 호텔은 위치가 아주 좋은 초와 외국인 이태원 중심에서 많은 로컬 레스토랑 옵션 및 쇼핑. 호텔 택시 서비스를 설정할 수 있는 한, 이 서비스는 제공 되는 무료 공항 픽업 서비스가 있었지만 제 자신이 돈을 내고, 객실이 실망스러운 가격을 생각하면. 나는 아침 식사는 실망스럽게 포함되어 있지 않습니다. 이 호텔을 예약하는 데 이상한 듯 100달러 와 밤을 아침 식사. 제가 나가면 맥도날드와 점심을 단 3 달러, 왜 그들은 나를 넘어 방에 추가할 수 없습니다. 직원들은 방에 있는 저를 도와 줍니다 설정할 수 있습니다. 전체적으로 모든 것이 깨끗하고 어떤 호텔에 기대하는 것은 한국에서, 아니지만 제 생각엔 가격이 조금 비싸지 지 않은 일부 라 편의 시설들이 포함되어. 또한, 금연 객실이 있었는데 그들이 말하는 사람이 담배 냄새가 난 훈제 욕실에 남아. 운이 좋게도 방 전체가 아니고."
아이티더블유 호텔,서울 용산구 우사단로14길 11,7.0,2021-2,8.0,편안한 숙박을 … =),"이곳에서 3일 밤을 이곳에서 즐겁게 머물렀습니다(2012년. 객실은 편안하고 기본적이지만 가장 중요한 변기 및 매일 청소하고 소독 가능. 로비 / 리셉션의 직원들은 매우 협조적이고 친절했습니다. 다만 이 경우 국제 플러그를 빌려 10, 000원 후 반환 이 머무르는 동안, 이 돈을.

7 eleven 편의점과 호텔 위치 (24시간 상점) & 할랄 레스토랑. 또한 많은 바에서 호텔로 가는 길. 일부라고 생각하지만 모든 것들이 우리가 머무는 동안은 괜찮고 안전하고 친절한 미소 를 또.

저는 밤에 혼자 걸어 이태원 거리를 따라 5분 정도에 있는 코스메틱 쇼핑 단지 내 호텔에서 도보 거리에 있다.

도 잊지 못할, 이 호텔이 성원, 호텔에서 나와서 왼쪽으로 돌 수 5 - 10 분 이태원의 성원에 도달할 것.

꽤 기본적이지만 확인을 조식이 제공됩니다.

전체적으로 좋은 숙박이 오고 또 오고 다음에 방문할 수 있습니다."
아이티더블유 호텔,서울 용산구 우사단로14길 11,7.0,2016-12,10.0,머물기 좋은 곳 … 근처에 있는,"좋은 직원들 –. 깨끗함은 아주 좋았습니다.
조금 언덕이었지만 위치가 매우 좋습니다.
근처에 지하철 역이 있고.
호떡 을 먹고 수, 그리고 떡볶이 odaeng 호텔 근처.
그냥 주변에 너무 많은 외국인이 있는 나이트 클럽."
아이티더블유 호텔,서울 용산구 우사단로14길 11,7.0,2016-12,6.0,할 수 있는 더 나은,"저는 이 곳에서 내가 가장 좋아하는 바 이었기 때문에 말 그대로 그냥 건너 시내를 걸었지만 하지 않기 에 할 수 있는 다시 한번 그 를 반복합니다. 너무 비싼 방들은 확실히 불구하고 par 는 ' 비 - 흡연 가능한 ' 할 수 있는 강력한 방에 냄새가 나 ㅆ다. 작고 오래된 방, 호텔 같은 느낌을 포기하지 않는다, 하지만 좋은 모텔 같은 곳 입니다."
아이티더블유 호텔,서울 용산구 우사단로14길 11,7.0,2016-12,6.0,가족과 함께 머물지 않는,"방이 아주 작은, 하지만 충분히 깨끗하고.
전혀 없었습니다. 비누, 샴푸와 컨디셔너 하는 작은 병에 제공됩니다. 1 2 일 동안 같은 메뉴는 아침 식사를 하고 있었습니다. 빵, 잼, 버터, 와 볶음밥.
24시간 편의점 과 걸어서 이용할 수 있는 택시를 타세요(한. 호텔 직원들은 매우 협조적이고 프론트 데스크에 24시간 대기.
제가 제일 좋아하는 이 호텔은 편안한 침대. 호텔 에 위치해 바, 술에 취한 사람들이 볼 수 있습니다 경우 새벽에 늦은 저녁에 나갔다."
아이티더블유 호텔,서울 용산구 우사단로14길 11,7.0,2021-2,6.0,"좋은 지역, 하지만 좋은 위치...","아주 좋은 호텔이 위치한 지역은 서울 - 지역 itwean - 멀티 문화 공간입니다. 나는 이 호텔을 볼 수 있는 이슬람 식당도 주변에 있기 때문에.
이 호텔은 좋은 객실에 멋진 & tv & 기술을 이용한 조명, 모두 하나의 원격 제어
이 호텔은 3성급 이하의 평가:
- 굉장히 작은 방
없음 - 전쟁 - 점적약제
- 아침 식사는
- 전원을 넣어 달라고 했을 때 이에 배치한 후 변환기의.
- 주변이 깨끗하지 않은 다른 가족의 마사지 센터 &..."
아이티더블유 호텔,서울 용산구 우사단로14길 11,7.0,2021-2,6.0,이태원의 Pit Stop,"이 호텔은 3년 전, 수 많은 사람들이 서있어서 상당히 현대적이 기 때문에. 주변에 시끄러울 수 있어서 좋은 방에서 뒤측. 직원들은 친절하고 도움을 요청해도 라테스톤을. 유일한 단점은 제가 한 것은 답답한 한 냄새가 났어요."
아이티더블유 호텔,서울 용산구 우사단로14길 11,7.0,2021-2,8.0,좋은 호텔,"나는 이 호텔을 막바지에 있어 나의 비행이 취소된 것. 방은 나쁘지 않음, 좀 편안했다. 아침 식사도 나쁘지 않았다. 가족과 아이들에게 좋지 않은 위치. 다음날 아침, 호텔 앞에서 술에 취한 사람들이 많아요."
아이티더블유 호텔,서울 용산구 우사단로14길 11,7.0,2021-2,8.0,좋았다.,"이 호텔은 예약이 꽉 차 있기 때문에 막판에 드래곤 힐 로지. 호텔 인테리어도 현대적인 스타일. 이 목적이 제공됩니다. 이태원 중심에 위치한 관광지. 바, 레스토랑, 상점, 기차역 등이 있다. 주변에 수많은 활동할 수 있는. 괜찮은 곳이 누워 쉴 수 있는 너무 많은 돈을 지출하지 않고 머리 위로."
아이티더블유 호텔,서울 용산구 우사단로14길 11,7.0,2021-2,4.0,주말에 서울에서 머물,"호텔은 대부분의 택시 운전사는 어렵고 차를 사용할 수 있는 방법을 아는, 어서 내려 아래쪽에 있는 호텔이다. 방은 깨끗했지만 전화를 가지고 있기 때문에 작업을 하지 않고 여행하고 있는 힐튼 호텔이나 그랜드 하얏트 어댑타 달리 미국 또는 usb 장치를 충전할 수 있. 또한 작은 수건을 가지고 있다면 사용할 수 있기때문에 욕실의 타월과 핸드 타올 이 제공되었다. 호텔 근처에 있는 많은 장소를 찾는다면 이곳 이지만 고급스런 보이지 않습니다. 나는 이 호텔에 다시는 묵지 않을 건지 것은 서울에서 사용할 수 있습니다."
아이티더블유 호텔,서울 용산구 우사단로14길 11,7.0,2021-2,6.0,나쁘지 않음,"이 방은 작지만 편안합니다. 사람을 쓰고 싶어 하지 않는 좋은 호텔이 많은 돈 ($100 정도), 한 번에 있는 호텔은 매우 비쌌어요. 주변 환경이 좋지 않아서, 이 문제가 없지만, 필요하면 300 미터 정도만 걸어 다니기 때문에 이미 대부분의 관광지에서 서울의 포인트 지점. 관광객들에게 좋은 곳."
아이티더블유 호텔,서울 용산구 우사단로14길 11,7.0,2021-2,6.0,나쁘지 않음,"가장 중요한 이유는 이 호텔이 choosed, 위치와 가격. 서울에 있는 호텔 모두 매우 expensie. 이 호텔은 아주 가까운 거리에서 이태원 지역. 전 세계 음식을 먹을 수 있을 정도의 호텔 나이트 클럽에서 아주 가깝습니다. 호텔 안의 개인적인, 협조적이지 않. 객실 지워지지 않습니다. 당신은 소음을 듣고, 자고 있을 때!"
아이티더블유 호텔,서울 용산구 우사단로14길 11,7.0,2021-2,4.0,상어,"객실은 작지만 깨끗하고 현대적인. 이상을 기대할 수 있는 싱글 룸에서 하룻밤 US100 진짜 대신 벽에 옷걸이 옷장 2개는 못. 가장 큰 문제. 밤에 도착하는 비행기 들 은 모두 9am 2pm에 체크인. 저는 그런 말을 할 수 있는 이른 체크인 시간당 W10000 (총 50000, 등.). 내야! 저는 이 필요하다. 명확하게 해 그들의 주머니 로 바로 갑니다 현금 지불을 하게 해낸 카드는 일정한 속도 이었다. 저와 같은 일을 기대 한 가운데에 있는 경우 흥등가."
아이티더블유 호텔,서울 용산구 우사단로14길 11,7.0,2014-12,10.0,"검토 itw 호텔 서울, 대한민국","이 호텔은 비교적 새 호텔 itw, 현대적인 방의 시설 -- 리모콘 트래킹코일 티비, 조명, A/C, 등. 객실은 괜찮은 현대식 욕실; 방은 좀 작지만. 직원들은 친절하고 협조적이었습니다. 하지만, 호텔 위치는 비교적 가까이에 몇몇 나이트 클럽과 바가 있어서 저녁에 주변을 것이 좋습니다.
저는 꼭 이곳에 다시는 이 제한"
